{
  "$schema": "https://json-schema.org/draft/2020-12/schema",
  "$id": "https://schemas.socioprophet.org/sociosphere/governance/procedure-template.v0.1.schema.json",
  "title": "ProcedureTemplate v0.1",
  "description": "Governed workflow template with required inputs, policy basis, evidence requirements, output schema, approval gate, and replay test.",
  "type": "object",
  "additionalProperties": false,
  "required": ["schemaVersion", "recordType", "templateId", "title", "version", "ownerRepo", "policyBasisRefs", "requiredInputs", "evidenceRequirements", "outputContract", "approvalGate", "replayTest", "provenance"],
  "properties": {
    "schemaVersion": { "const": "governance.procedure-template.v0.1" },
    "recordType": { "const": "ProcedureTemplate" },
    "templateId": { "type": "string", "minLength": 1 },
    "title": { "type": "string", "minLength": 1 },
    "version": { "type": "string", "minLength": 1 },
    "ownerRepo": { "type": "string", "minLength": 1 },
    "status": { "type": "string", "enum": ["draft", "active", "deprecated", "retired"] },
    "authorityBoundaryRef": { "type": "string", "minLength": 1 },
    "policyBasisRefs": {
      "type": "array",
      "minItems": 1,
      "items": { "type": "string", "minLength": 1 }
    },
    "requiredInputs": {
      "type": "array",
      "minItems": 1,
      "items": {
        "type": "object",
        "additionalProperties": false,
        "required": ["name", "kind", "required"],
        "properties": {
          "name": { "type": "string", "minLength": 1 },
          "kind": { "type": "string", "enum": ["actor", "role", "context", "evidence", "policy", "asset", "freeform", "artifact_ref"] },
          "required": { "type": "boolean" },
          "schemaRef": { "type": "string", "minLength": 1 }
        }
      }
    },
    "evidenceRequirements": {
      "type": "array",
      "minItems": 1,
      "items": {
        "type": "object",
        "additionalProperties": false,
        "required": ["requirementId", "description", "minAuthorityClass"],
        "properties": {
          "requirementId": { "type": "string", "minLength": 1 },
          "description": { "type": "string", "minLength": 1 },
          "minAuthorityClass": { "type": "string", "enum": ["canonical", "policy", "procedure", "evidence", "context", "external", "advisory"] },
          "acceptedKinds": { "type": "array", "minItems": 1, "items": { "type": "string" } }
        }
      }
    },
    "outputContract": {
      "type": "object",
      "additionalProperties": false,
      "required": ["schemaRef", "permittedOutputs"],
      "properties": {
        "schemaRef": { "type": "string", "minLength": 1 },
        "permittedOutputs": { "type": "array", "minItems": 1, "items": { "type": "string", "minLength": 1 } }
      }
    },
    "approvalGate": {
      "type": "object",
      "additionalProperties": false,
      "required": ["required", "mode"],
      "properties": {
        "required": { "type": "boolean" },
        "mode": { "type": "string", "enum": ["none", "single_human", "domain_owner", "quorum", "external_authority"] },
        "approverRoleRefs": { "type": "array", "items": { "type": "string", "minLength": 1 } }
      }
    },
    "replayTest": {
      "type": "object",
      "additionalProperties": false,
      "required": ["required", "fixtureRef"],
      "properties": {
        "required": { "type": "boolean" },
        "fixtureRef": { "type": "string", "minLength": 1 },
        "expectedReceiptKind": { "type": "string", "minLength": 1 }
      }
    },
    "provenance": {
      "type": "object",
      "additionalProperties": false,
      "required": ["createdBy", "createdAt", "sourceRepo", "nonSecret"],
      "properties": {
        "createdBy": { "type": "string", "minLength": 1 },
        "createdAt": { "type": "string", "format": "date-time" },
        "sourceRepo": { "type": "string", "minLength": 1 },
        "sourceCommit": { "type": "string", "minLength": 1 },
        "nonSecret": { "type": "boolean" }
      }
    }
  }
}
